symptom,disease
"I've been dealing with coughing constantly, low energy, chills and feeling feverish recently.",flu
"I'm suffering from my head's been pounding, exhaustion, chills, can't stop coughing and running a temperature for a while now.",flu
"I wanted to tell you about coughing constantly, my body's been burning up, terrible head pain and body aches for a while now.",flu
"Recently I've been having running a temperature, can't stop coughing, constant headaches and body aches.",flu
"Doctor, I'm struggling with body aches, constant headaches, a nagging cough, always tired plus chills and it's getting worse.",flu
"Doctor, I'm dealing with coughing constantly, running a temperature, also body aches recently.",flu
"I have can't stop coughing, chills, exhaustion and running a temperature since a few days.",flu
"I wanted to tell you about painful throat, feeling drained, coughing constantly and running a temperature since a few days.",flu
"I feel can't swallow properly, chills, body aches, persistent cough and also feeling completely worn out and I'm worried.",flu
"Recently I've been having can't stop coughing, chills, body aches n can't swallow properly.",flu
"I keep having chills, scratchy throat, body aches and my body's been burning up.",flu
"I've been experiencing feelin drained, a nagging cough, body aches and can't swallow properly recently.",flu
"Been having coughing constantly, chills, feeling drained and scratchy throat and I don't know what to do.",flu
"I've been dealing with body aches, feeling completely worn out, feeling feverish nd persistent cough.",flu
"I'm dealing with feeling feverish, can't swallow properly, chills, coughing constantly, body aches and exhaustion and I'm worried.",flu
"I wanted to tell you about can't swallow properly, chills, body aches and persistent cough.",flu
"I keep experiencing always tired, can't swallow properly, chills and can't stop coughing.",flu
"I'm troubled by scratchy throat, body aches, constant headaches, high temperature, tiredness and also a nagging cough since a few days.",flu
"I keep having feeling completely worn out, throbbing head pain, can't stop coughing, feeling feverish, chills, body aches n also can't swallow properly since a few days.",flu
"Been having running a temperature, tiredness, can't stop coughing and terrible head pain for a while now.",flu
"I'm suffering from body aches, feeling feverish, chills, a nagging cough, low energy and can't swallow properly for a while now.",flu
"I'm suffering from running a temperature, body aches, my head's been pounding, chills nd also a nagging cough.",flu
"Been having chills, tiredness, terrible head pain, feeling feverish, a nagging cough, body aches and also my throat is killing me recently.",flu
"Over the past few days I've noticed can't swallow properly, can't stop coughing, high temperature, chills, body aches plus tiredness and I'm worried.",flu
"I wanted to tell you about coughing constantly, scratchy throat, feeling feverish, body aches and also chills.",flu
"I keep feeling my body's been burning up, persistent cough, chills, throbbing head pain, always tired and body aches.",flu
my issue is queasiness as well as my body's been burning up since a few days.,food poisoning
"Lately I've had running a temperature, also been sick multiple times since a few days.",food poisoning
"I have runny stomach, been sick multiple times, general weakness, feeling sick to my stomach and running a temperature.",food poisoning
"Lately I've been dealing with feeling sick to my stomach, frequent bathroom trips combined with high temperature.",food poisoning
"I have general weakness, queasiness as well as high temperature.",food poisoning
"I feel general weakness, also running a temperature recently.",food poisoning
"I wanted to tell you about feeling really weak, also vomiting a lot.",food poisoning
I wanted to tell you about my body's been burning up plus runny stomach recently.,food poisoning
"My problem is been sick multiple times, general weakness, the urge to vomit, frequent bathroom trips and also running a temperature recently.",food poisoning
"I'm struggling with watery movements, high temperature, queasiness, general weakness and been sick multiple times and it's getting worse.",food poisoning
"Been having general weakness, abdominal cramps combined with the urge to vomit for a while now.",food poisoning
"I have dehydration, abdominal cramps and the urge to vomit.",food poisoning
"I have vomiting a lot, running a temperature, body feels like jelly, the urge to vomit, abdominal cramps and also dehydration.",food poisoning
"Doctor, I'm dealing with my body's been burning up, abdominal cramps, upset stomach, general weakness and vomiting a lot.",food poisoning
"I keep having been sick multiple times, dehydration, abdominal cramps and body feels like jelly recently.",food poisoning
"The issue I'm facing is dehydration, the urge to vomit, abdominal cramps and feelin feverish.",food poisoning
"Been having dehydration, the urge to vomit, abdominal cramps, vomiting a lot nd body feels like jelly and I don't know what to do.",food poisoning
"I keep feeling no strength at all, dehydration, abdominal cramps, the urge to vomit, been sick multiple times and also running a temperature since a few days.",food poisoning
"I've been going through dehydration, abdominal cramps, upset stomach, general weakness and running a temperature recently.",food poisoning
"I wanted to tell you about my body's been burning up, no strength at all, throwing up and the urge to vomit.",food poisoning
"I keep noticing been sick multiple times, my body's been burning up n the urge to vomit.",food poisoning
"Recently I've been having upset stomach, running a temperature combined with been sick multiple times.",food poisoning
"Doctor, I've been having vomiting a lot, the urge to vomit as well as my body's been burning up recently.",food poisoning
"Doctor, I'm dealing with feeling sick to my stomach, my body's been burning up and been sick multiple times recently n stuff",food poisoning
"Doctor, I'm dealing with puking, running a temperature and feelin sick to my stomach and I'm worried.",food poisoning
"I keep having queasiness, feeling feverish and throwing up and I'm worried.",food poisoning
"I've been experiencing the urge to vomit, running a temperature combined with been sick multiple times and it's getting worse.",food poisoning
"got high temperature, puking along with feeling sick to my stomach.",food poisoning
"Doctor, I'm dealing with queasiness, feeling feverish and puking and I don't know what to do.",food poisoning
"I keep having vomiting a lot, queasiness combined with my body's been burning up since a few days.",food poisoning
"Recently I've been having been sick multiple times, dehydration, my body's been burning up, the urge to vomit and frequent bathroom trips since a few days.",food poisoning
"I've been experiencing dehydration, queasiness, frequent bathroom trips, feeling feverish and been sick multiple times and it's getting worse.",food poisoning
"I'm suffering from runny stomach, dehydration, upset stomach, feelin feverish plus puking for a while now.",food poisoning
I'm suffering from frequent bathroom trips along with feeling sick to my stomach recently.,food poisoning
"My problem is high temperature, puking, queasiness and watery movements for a while now.",food poisoning
Recently I've started having high temperature combined with puking and I don't know what to do.,food poisoning
"I have dehydration, runny stomach, queasiness and throwing up since a few days.",food poisoning
"Doctor, I'm dealing with my body's been burning up, dehydration, watery movements, throwing up plus queasiness.",food poisoning
My problem is puking along with queasiness.,food poisoning
"I keep having dehydration, upset stomach n watery movements and it's getting worse.",food poisoning
I wanted to tell you about puking as well as feeling feverish for a while now.,food poisoning
"I feel abdominal cramps, queasiness plus watery movements for a while now.",food poisoning
"Doctor, I'm dealing with loose watery stools, abdominal cramps, my body's been burning up, puking and also the urge to vomit recently.",food poisoning
"I have abdominal cramps, the urge to vomit and running a temperature and I don't know what to do.",food poisoning
"What's bothering me is upset stomach, my body's been burning up along with abdominal cramps and I don't know what to do.",food poisoning
"I've been dealing with upset stomach, abdominal cramps n also my body's been burning up and it's getting worse.",food poisoning
"Doctor, I've been experiencing my body's been burning up and puking and it's getting worse.",food poisoning
"I have feeling feverish, upset stomach, loose watery stools, puking plus abdominal cramps and I'm worried.",food poisoning
"Lately I've had abdominal cramps, the urge to vomit combined with feeling feverish.",food poisoning
"I keep feelin high temperature, runny stomach, abdominal cramps and the urge to vomit for a while now.",food poisoning
"I feel cracked skin, discoloration as well as redness.",fungal infection
Been having discoloration plus redness.,fungal infection
"I've been dealing with discoloration, rash all over my skin, cracked skin and redness and it's getting worse.",fungal infection
"Doctor, I'm dealing with redness, cracked skin and skin breaking out in rash.",fungal infection
"I have redness, cracked skin along with rash all over my skin.",fungal infection
I feel discoloration and rash all over my skin recently.,fungal infection
I keep having discoloration as well as redness since a few days.,fungal infection
"I'm suffering from red skin rash, also cracked skin since a few days.",fungal infection
I wanted to tell you about discoloration combined with red skin rash.,fungal infection
"For a while now I've had rash all over my skin, redness, discoloration and cracked skin for a while now.",fungal infection
"I wanted to tell you about redness, discoloration, red skin rash and peeling skin.",fungal infection
"I'm suffering from rash all over my skin, peeling skin, discoloration and redness.",fungal infection
"Doctor, I'm dealing with discoloration, red skin rash, also peeling skin n I'm worried.",fungal infection
"I've been experiencing redness, red skin rash plus discoloration and I'm worried n stuff",fungal infection
"My problem is skin breaking out in rash, peeling skin, discoloration and redness for a while now.",fungal infection
I have discoloration and red skin rash since a few days.,fungal infection
"I wanted to tell you about discoloration, peeling skin, redness and red skin rash.",fungal infection
"Recently I've been having kinda skin breaking out in rash, also discoloration and I don't know what to do.",fungal infection
"Recently I've been having peeling skin, discoloration as well as rash all over my skin and it's getting worse.",fungal infection
I feel rash all over my skin as well as peeling skin and I'm worried.,fungal infection
"I'm suffering from cracked skin, burning feeling, severe itching, rash all over my skin plus redness for a while now.",fungal infection
"Doctor, I'm struggling with redness, hot burning sensation combined with red skin rash for a while now.",fungal infection
"I keep getting cracked skin, hot burning sensation combined with redness.",fungal infection
"Lately I've had stinging burn, constant scratching, cracked skin, discoloration and redness.",fungal infection
"I feel discoloration, rash all over my skin, constant scratching, hot burning sensation, redness and cracked skin since a few days.",fungal infection
"Recently I've been experiencing red skin rash, stinging burn along with redness for a while now.",fungal infection
"I have cracked skin, constant scratching, burning feeling and skin breaking out in rash.",fungal infection
"I've been struggling with cracked skin, constant scratching combined with rash all over my skin and I'm worried.",fungal infection
"Lately I've had burning feeling, rash all over my skin, cracked skin, redness and severe itching, kinda worried",fungal infection
"I'm going through redness, skin breaking out in rash, cracked skin, discoloration and constant scratching.",fungal infection
"Recently I've been having cracked skin, skin breaking out in rash and discoloration and it's getting worse.",fungal infection
"Recently I've been having discoloration, burning feeling, cracked skin and peeling skin.",fungal infection
"I wanted to tell you about discoloration, peeling skin, constant scratching and cracked skin and I don't know what to do.",fungal infection
"I feel cracked skin, skin breaking out in rash combined with constant scratching.",fungal infection
"Lately I've had discoloration, red skin rash as well as burning feeling recently.",fungal infection
"I keep having rash all over my skin, cracked skin, stinging burn, severe itching and also discoloration.",fungal infection
"Lately I've had rash all over my skin, peeling skin and burning feelin recently.",fungal infection
"I've been experiencing cracked skin, red skin rash, burning feeling, constant scratching and peeling skin for a while now.",fungal infection
"Lately I've had itchy skin, skin breaking out in rash, peeling skin and burning feeling recently.",fungal infection
"My problem is severe itching, discoloration along with cracked skin since a few days.",fungal infection
"I wanted to tell you about rash all over my skin, stinging burn, constant scratching and redness and it's getting worse.",fungal infection
"I've been experiencing itchy skin, redness, discoloration, skin breaking out in rash plus stinging burn.",fungal infection
"I've been dealing with burning feeling, can't stop itching and red skin rash.",fungal infection
Been having redness combined with discoloration.,fungal infection
Recently I've been having constant scratching and redness and it's getting worse.,fungal infection
These days I've been having redness combined with hot burning sensation since a few days.,fungal infection
"I wanted to tell you about discoloration, hot burning sensation, redness, constant scratching and skin breaking out in rash.",fungal infection
"Doctor, I'm dealing with stinging burn, severe itching, discoloration and skin breaking out in rash and I don't know what to do.",fungal infection
"Doctor, I'm dealing with hot burning sensation, redness, constant scratching and discoloration since a few days.",fungal infection
"my issue is discoloration, hot burning sensation, rash all over my skin and redness since a few days.",fungal infection
"I've been dealing with indigestion, throwing up, stomach cramps, shooting back pain, bloating and also upset stomach.",gallstones
"I'm suffering from puking, upset stomach combined with bloating.",gallstones
"I keep feeling indigestion, puking, pain in my belly and bloating, getting worse",gallstones
"Been having bloating, queasiness, indigestion, stomach cramps, puking and constant backache.",gallstones
"I wanted to tell you about pain in my belly, back hurts badly, the urge to vomit, been sick multiple times, bloating plus indigestion.",gallstones
"I've been experiencing indigestion, stomach cramps, bloating, yellowing of my skin, throwing up and shooting back pain and I'm worried.",gallstones
"Doctor, I've been having bloating, pain in my belly, vomiting a lot, feeling sick to my stomach, pain in my back, indigestion and also skin turned yellow and I don't know what to do.",gallstones
"Doctor, I'm dealing with vomiting a lot, indigestion, also skin turned yellow since a few days.",gallstones
"Doctor, I'm dealing with indigestion, been sick multiple times, tummy ache, back hurts badly, yellow eyes, bloating and also upset stomach and I don't know what to do.",gallstones
"I'm suffering from bloating, pain in my back, yellowing of my skin, indigestion, pain in my belly, throwing up plus the urge to vomit.",gallstones
"Doctor, I'm dealing with yellow eyes, indigestion, bloating and pain in my belly.",gallstones
"I've been experiencing indigestion, bloating, gut pain and skin turned yellow for a while now.",gallstones
"I'm dealing with bloating, gut pain, yellowing of my skin and indigestion and I don't know what to do.",gallstones
I have indigestion combined with bloating.,gallstones
"I've been experiencing stomach cramps, bloating, indigestion and yellow eyes recently.",gallstones
I keep having yellow eyes combined with indigestion recently.,gallstones
"I'm suffering from stomach cramps, skin turned yellow, indigestion, bloating plus upset stomach.",gallstones
"My problem is bloating, indigestion, feeling sick to my stomach and gut pain and I don't know what to do.",gallstones
"I wanted to tell you about indigestion, feeling sick to my stomach, bloating, yellow eyes and gut pain for a while now.",gallstones
"My problem is bloating, the urge to vomit and pain in my belly and it's getting worse.",gallstones
"I've been dealing with bloating, upset stomach, shooting back pain, gut pain, puking and also skin turned yellow recently tbh",gallstones
"I've been dealing with back hurts badly, bloating, also skin turned yellow since a few days.",gallstones
"Recently I've been having throwing up, pain in my back as well as bloating for a while now.",gallstones
"I'm troubled by throwing up, skin turned yellow combined with feeling sick to my stomach and I'm worried.",gallstones
"Doctor, I'm dealing with bloating, constant backache, also vomiting a lot recently.",gallstones
"I keep feeling bloating, stomach pain along with lost my appetite and it's getting worse.",gastritis
"I wanted to tell you about throwing up, indigestion and stomach pain.",gastritis
"I feel queasiness, bloating, stomach pain, vomiting a lot and also indigestion and it's getting worse n stuff",gastritis
"Been having kinda indigestion, bloating, stomach pain, queasiness, puking and no desire to eat.",gastritis
"I've been dealing with queasiness, no desire to eat, indigestion and bloating.",gastritis
"I keep experiencing feeling sick to my stomach, bloating, stinging burn, indigestion plus vomiting a lot and it's getting worse.",gastritis
"I'm suffering from upset stomach, indigestion and hot burning sensation and I don't know what to do.",gastritis
"I've been experiencing vomiting a lot, stomach pain, upset stomach, indigestion, stinging burn plus bloating.",gastritis
"I've been experiencing been sick multiple times, indigestion as well as stomach pain n it's getting worse.",gastritis
"I've been having been sick multiple times, stomach pain, burning feeling, indigestion, bloating and upset stomach for a while now.",gastritis
"Recently I've been having lost my appetite, puking, burning feeling, stomach pain and bloating.",gastritis
"I feel lost my appetite, bloating and hot burning sensation.",gastritis
I've been experiencing not feeling hungry at all and hot burning sensation and I'm worried.,gastritis
"I keep noticing been sick multiple times, bloating, lost my appetite and hot burning sensation.",gastritis
"I've been experiencing stomach pain, stinging burn, no desire to eat, bloating plus been sick multiple times since a few days.",gastritis
"Lately I've had bloating, burning feeling and feeling sick to my stomach and I don't know what to do.",gastritis
"Lately I've been dealing with kinda bloating, throwing up, no desire to eat and burning feeling.",gastritis
I've been experiencing vomiting a lot and no desire to eat.,gastritis
"Lately I've had can't eat properly, bloating and upset stomach since a few days, kinda worried",gastritis
"I keep having been sick multiple times, hot burning sensation, bloating, lost my appetite and feelin sick to my stomach for a while now.",gastritis
"I've been dealing with bloating, not feeling hungry at all, stomach pain, burning feeling, the urge to vomit, indigestion and also vomiting a lot.",gastritis
"I've been dealing with the urge to vomit, stomach pain, indigestion, bloating, vomiting a lot and lost my appetite.",gastritis
"I'm struggling with indigestion, puking, stomach pain, feeling sick to my stomach, stinging burn and no desire to eat and I don't know what to do.",gastritis
"I feel stomach pain, bloating plus been sick multiple times.",gastritis
"I keep having not feeling hungry at all, indigestion plus throwing up.",gastritis
"Recently I've been having acid regurgitation, heartburn, chest discomfort and can't swallow properly.",gastroesophageal reflux disease
My problem is acid regurgitation along with can't swallow properly since a few days.,gastroesophageal reflux disease
"Doctor, I'm dealing with painful throat and acid regurgitation for a while now.",gastroesophageal reflux disease
"Doctor, I've been experiencing a bit acid regurgitation, can't swallow properly, also heartburn.",gastroesophageal reflux disease
My problem is chest discomfort and painful throat recently.,gastroesophageal reflux disease
"I've been experiencing painful throat, chest discomfort, also acid regurgitation and I don't know what to do.",gastroesophageal reflux disease
"I have acid regurgitation, heartburn, chest discomfort and painful throat.",gastroesophageal reflux disease
"I'm suffering from my throat is killing me, acid regurgitation, chest discomfort and heartburn for a while now.",gastroesophageal reflux disease
"I keep experiencing acid regurgitation, scratchy throat and chest discomfort since a few days.",gastroesophageal reflux disease
"I feel can't swallow properly, acid regurgitation and chest discomfort.",gastroesophageal reflux disease
"I have coughing constantly, heartburn, can't swallow properly, acid regurgitation and also chest discomfort recently.",gastroesophageal reflux disease
"I feel acid regurgitation, bloating, heartburn and chest discomfort recently.",gastroesophageal reflux disease
"The issue I'm facing is bloating, can't stop coughing, chest discomfort and acid regurgitation.",gastroesophageal reflux disease
"I've been experiencing bloating, can't swallow properly, acid regurgitation and heartburn and it's getting worse.",gastroesophageal reflux disease
"I'm suffering from heartburn, chest discomfort, acid regurgitation, coughing constantly, bloating and also my throat is killing me.",gastroesophageal reflux disease
"Doctor, I'm dealing with scratchy throat, bloating, acid regurgitation, can't stop coughing, heartburn and chest discomfort and I don't know what to do.",gastroesophageal reflux disease
"Recently I've been having heartburn, bloating, acid regurgitation, painful throat, a nagging cough and chest discomfort.",gastroesophageal reflux disease
"I've been experiencing heartburn, bloating, persistent cough and acid regurgitation recently.",gastroesophageal reflux disease
"I have painful throat, heartburn, chest discomfort, a nagging cough, bloating plus acid regurgitation and I don't know what to do.",gastroesophageal reflux disease
"Doctor, I'm dealing with chest discomfort, acid regurgitation, heartburn, bloating and painful throat.",gastroesophageal reflux disease
"My problem is scratchy throat, heartburn, acid regurgitation, chest discomfort, a nagging cough plus trouble with swallowing recently.",gastroesophageal reflux disease
"Been having trouble with swallowing, heartburn and acid regurgitation recently.",gastroesophageal reflux disease
"I've been dealing with heartburn, persistent cough, acid regurgitation, bloating, trouble with swallowing, chest discomfort and painful throat for a while now.",gastroesophageal reflux disease
"Doctor, I'm struggling with acid regurgitation, my throat is killing me along with can't stop coughing.",gastroesophageal reflux disease
"Recently I've been dealing with coughing constantly, heartburn, trouble with swallowing, bloating, chest discomfort, acid regurgitation plus scratchy throat since a few days.",gastroesophageal reflux disease
"I keep having painful throat, chest discomfort, bloating, a nagging cough and acid regurgitation recently.",gastroesophageal reflux disease
"My problem is heartburn, persistent cough, my throat is killing me and bloating and I'm worried.",gastroesophageal reflux disease
"I keep feeling can't swallow properly, heartburn, chest discomfort, bloating and also trouble with swallowing and it's getting worse.",gastroesophageal reflux disease
"I keep feeling persistent cough, heartburn and trouble with swallowing since a few days.",gastroesophageal reflux disease
"Been having bloating, acid regurgitation and chest discomfort since a few days.",gastroesophageal reflux disease
I have bloating and acid regurgitation for a while now.,gastroesophageal reflux disease
I keep feeling heartburn and chest discomfort and I'm worried.,gastroesophageal reflux disease
"What's bothering me is acid regurgitation, also bloating and I don't know what to do.",gastroesophageal reflux disease
"I'm suffering from acid regurgitation, chest discomfort and bloating.",gastroesophageal reflux disease
"I have heartburn, bloating, acid regurgitation and chest discomfort.",gastroesophageal reflux disease
"Recently I've started having bloating, acid regurgitation along with chest discomfort and I'm worried.",gastroesophageal reflux disease
I've been experiencing heartburn plus chest discomfort since a few days.,gastroesophageal reflux disease
"I have acid regurgitation, chest discomfort along with bloating for a while now.",gastroesophageal reflux disease
"Doctor, I'm dealing with chest discomfort, bloating, heartburn and acid regurgitation since a few days.",gastroesophageal reflux disease
"I keep feeling acid regurgitation, chest discomfort, heartburn and bloating since a few days.",gastroesophageal reflux disease
"Doctor, I'm dealing with trouble with swallowing, acid regurgitation combined with heartburn and it's getting worse.",gastroesophageal reflux disease
"I've been dealing with acid regurgitation, bloating along with trouble with swallowing.",gastroesophageal reflux disease
