symptom,disease
"Recently I've been having sweating, feeling completely worn out, terrible head pain and vomiting a lot and I'm worried.",malaria
"I'm suffering from sweating, throwing up, chills and feelin feverish and it's getting worse.",malaria
"Doctor, I'm dealing with sweating, feeling feverish n upset stomach and it's getting worse.",malaria
"I wanted to tell you about puking, sweating as well as running a temperature.",malaria
"I've been dealing with the urge to vomit, chills, puking, running a temperature and sweating recently.",malaria
I keep feeling vomiting a lot and chills for a while now.,malaria
"Doctor, I'm struggling with chills, also sweating since a few days.",malaria
"Recently I've been having puking, the urge to vomit, also running a temperature recently.",malaria
"I have sweating, vomiting a lot, also chills.",malaria
I keep feeling chills plus feeling feverish and it's getting worse.,malaria
"I feel been sick multiple times, chills, feeling feverish and sweating.",malaria
"I wanted to tell you about been sick multiple times, rigid neck along with constant headaches for a while now.",meningitis
"My problem is mind feels foggy, feeling feverish as well as neck feels locked up for a while now.",meningitis
"Been having queasiness, feeling feverish, rigid neck, can't think straight plus throbbing head pain.",meningitis
"I wanted to tell you about running a temperature, vomiting a lot, stiff neck, terrible head pain, the urge to vomit and also mental cloudiness.",meningitis
"I keep getting mind feels foggy, throwing up, running a temperature, neck feels locked up plus feeling sick to my stomach for a while now.",meningitis
Lately I've been dealing with constant headaches and puking.,meningitis
been dealing with my head's been pounding combined with been sick multiple times recently.,meningitis
"What's bothering me is been sick multiple times, mind feels foggy, constant headaches, stiff neck and queasiness.",meningitis
Been having been sick multiple times plus terrible head pain and it's getting worse.,meningitis
"Lately I've had constant headaches, puking, feeling confused, the urge to vomit and rigid neck.",meningitis
"Recently I've been having puking, also high temperature and I don't know what to do.",meningitis
These days I've been having puking and can barely move my neck and I'm worried.,meningitis
"I've been struggling with running a temperature, upset stomach, throbbing head pain, been sick multiple times and stiff neck and it's getting worse.",meningitis
"I keep having throwing up, running a temperature, terrible head pain, neck feels locked up plus the urge to vomit.",meningitis
"I keep experiencing constant headaches, rigid neck, puking, running a temperature plus feeling sick to my stomach since a few days.",meningitis
"I keep feeling the urge to vomit, also running a temperature and I'm worried.",meningitis
"Been having queasiness, my head's been pounding and my body's been burning up and I don't know what to do.",meningitis
Recently I've been having throbbing head pain and feeling confused.,meningitis
"I've been dealing with my head's been pounding, feeling sick to my stomach, can't think straight and running a temperature.",meningitis
"I have queasiness, mind feels foggy, running a temperature and constant headaches.",meningitis
"Recently I've started having running a temperature, vomiting a lot, feeling sick to my stomach and stiff neck.",meningitis
"I keep having running a temperature, bright lights are painful and puking and it's getting worse.",meningitis
"I've been dealing with throwing up, rigid neck, bright lights are painful, the urge to vomit and running a temperature and I'm worried.",meningitis
"I keep feeling high temperature, been sick multiple times combined with photosensitivity.",meningitis
I have upset stomach and puking.,meningitis
"My problem is general weakness, balance issues, tingling sensation and coordination problems for a while now.",multiple sclerosis
"I keep feelin coordination problems, pins and needles, general weakness, balance issues and vision problems.",multiple sclerosis
"I've been dealing with kinda body feels like jelly, coordination problems, pins and needles, tingling sensation, vision problems and balance issues and I don't know what to do.",multiple sclerosis
"I keep noticing vision problems, coordination problems, feeling really weak, tingling sensation, loss of sensation and also balance issues.",multiple sclerosis
"I have vision problems, tingling sensation, balance issues, coordination problems plus body feels like jelly recently.",multiple sclerosis
"Doctor, I'm dealing with vision problems, exhaustion, loss of sensation, no strength at all, tingling sensation and also coordination problems and I'm worried.",multiple sclerosis
"I'm suffering from vision problems, numbness in my body combined with tingling sensation.",multiple sclerosis
"I've been dealing with coordination problems, always tired, body feels like jelly, body parts going numb, tingling sensation and vision problems and I'm worried.",multiple sclerosis
"My problem is feeling really weak, tiredness, vision problems and body parts going numb.",multiple sclerosis
"I feel exhaustion, no strength at all, loss of sensation, coordination problems, tingling sensation and vision problems and it's getting worse.",multiple sclerosis
"I keep having vision problems, balance issues, exhaustion, coordination problems, body feels like jelly plus numbness in my body.",multiple sclerosis
"I feel loss of sensation, vision problems, coordination problems, tiredness and balance issues and I'm worried.",multiple sclerosis
"I've been experiencing vision problems, general weakness, coordination problems, loss of sensation and balance issues for a while now.",multiple sclerosis
"I keep feeling feeling drained, pins and needles, body feels like jelly, balance issues, coordination problems and vision problems.",multiple sclerosis
"Doctor, I'm dealing with coordination problems, pins and needles, balance issues and vision problems.",multiple sclerosis
"I wanted to tell you about vision problems, coordination problems, feeling drained and balance issues since a few days.",multiple sclerosis
"I feel vision problems, coordination problems, tingling sensation, loss of sensation plus low energy recently.",multiple sclerosis
"I've been dealing with tiredness, vision problems, tingling sensation, pins and needles and also balance issues.",multiple sclerosis
"Doctor, I've been having vision problems, balance issues, pins and needles and tingling sensation.",multiple sclerosis
"I have loss of sensation, coordination problems, vision problems and tingling sensation for a while now.",multiple sclerosis
"Been having vision problems, general weakness, loss of sensation, tingling sensation, balance issues, coordination problems and exhaustion and it's getting worse.",multiple sclerosis
"I keep feeling always tired, coordination problems, numbness in my body, tingling sensation, balance issues and no strength at all.",multiple sclerosis
"My problem is tingling sensation, vision problems, coordination problems, body feels like jelly, balance issues, low energy and loss of sensation for a while now.",multiple sclerosis
"Doctor, I'm dealing with numbness in my body, feeling drained, balance issues, no strength at all, tingling sensation, coordination problems and also vision problems.",multiple sclerosis
"I keep having body feels like jelly, numbness in my body, coordination problems, tingling sensation, exhaustion, vision problems and also balance issues recently.",multiple sclerosis
"I'm suffering from back hurts badly, losing my height, limited mobility, joints hurting bad, body feels like jelly, stooped posture and fractured bones and I don't know what to do.",osteoporosis
"Been having back hurts badly, limited mobility, bones breaking easily, sore joints and also no strength at all for a while now.",osteoporosis
"Been having back hurts badly, fractured bones, stooped posture, pain in my joints, feeling really weak, limited mobility plus losing my height and I don't know what to do.",osteoporosis
"Been having fragile bones, joints hurting bad, stooped posture, limited mobility plus pain in my back for a while now.",osteoporosis
"Doctor, I'm dealing with losing my height, limited mobility and aching joints since a few days.",osteoporosis
"I feel sore joints, limited mobility, fractured bones, losing my height plus pain in my back since a few days.",osteoporosis
I'm suffering from constant backache and losing my height.,osteoporosis
"Recently I've been having limited mobility, bones breaking easily, pain in my joints, losing my height and constant backache and I'm worried.",osteoporosis
"Lately I've had limited mobility, back hurts badly, also fragile bones and I don't know what to do.",osteoporosis
I've been having limited mobility along with fragile bones.,osteoporosis
"Lately I've had fractured bones, stooped posture plus back hurts badly for a while now.",osteoporosis
"I keep feeling constant backache, pain in my joints, stooped posture and losing my height recently.",osteoporosis
"I've been experiencing sore joints, pain in my back along with fragile bones and I'm worried.",osteoporosis
"Doctor, I'm dealing with pain in my back, sore joints, bones breaking easily, stooped posture, losing my height and general weakness for a while now.",osteoporosis
"I have fragile bones, sore joints plus stooped posture recently.",osteoporosis
"I keep experiencing limited mobility, sore joints, feeling really weak and fragile bones for a while now.",osteoporosis
I keep having feeling really weak plus pain in my joints for a while now.,osteoporosis
I'm suffering from limited mobility plus fractured bones.,osteoporosis
I keep having aching joints combined with fragile bones.,osteoporosis
"I've been experiencing pain in my joints, fragile bones plus limited mobility.",osteoporosis
"I've been dealing with no strength at all, losing my height, stooped posture and bones breaking easily.",osteoporosis
I keep feelin general weakness and losing my height and it's getting worse.,osteoporosis
"I have body feels like jelly, bones breaking easily, stooped posture and losing my height.",osteoporosis
Recently I've been dealing with losing my height combined with bones breaking easily since a few days.,osteoporosis
"got body feels like jelly, fractured bones, stooped posture and losing my height for a while now.",osteoporosis
"Recently I've been having balance issues, fluid drainage, ear fullness and ear ache for a while now.",otitis media
"I keep feeling high temperature, fluid drainage, ear fullness, irritability, throbbing ear pain and also balance issues.",otitis media
"Doctor, I'm dealing with ear fullness, my body's been burning up, fluid drainage, balance issues, pain deep in my ear and irritability recently.",otitis media
"I have fluid drainage, my body's been burning up as well as balance issues.",otitis media
"I feel fluid drainage, ear ache along with balance issues and I don't know what to do.",otitis media
"Lately I've had running a temperature, ear fullness and fluid drainage.",otitis media
"I'm going through my body's been burning up, fluid drainage, irritability and ear fullness.",otitis media
I'm suffering from ear ache along with irritability and I'm worried.,otitis media
"I have pain deep in my ear, feeling feverish, irritability and ear fullness since a few days.",otitis media
"I've been dealing with throbbing ear pain, high temperature and ear fullness.",otitis media
"Doctor, I'm dealing with my body's been burning up, ear ache, ear fullness, balance issues, hearing loss plus irritability.",otitis media
"Been having feeling feverish, balance issues, hearing loss, irritability and ear fullness and I don't know what to do.",otitis media
"I've been experiencing ear fullness, hearing loss, my body's been burning up, balance issues, my ear really hurts and irritability.",otitis media
"I feel irritability, throbbing ear pain, balance issues and ear fullness and it's getting worse.",otitis media
"I feel balance issues, ear fullness, ear ache, hearing loss, irritability and also my body's been burning up and it's getting worse.",otitis media
"I have hearing loss, ear fullness, also running a temperature for a while now.",otitis media
"My problem is ear fullness, ear ache, hearing loss, high temperature plus irritability since a few days.",otitis media
"Lately I've had hearing loss, throbbing ear pain, ear fullness and irritability since a few days.",otitis media
"Doctor, I've been experiencing ear fullness, hearing loss, my ear really hurts and my body's been burning up.",otitis media
"Recently I've been experiencing irritability, ear fullness, hearing loss and ear ache for a while now.",otitis media
"I have fluid drainage, irritability, hearing loss and ear fullness.",otitis media
"Over the past few days I've noticed feeling feverish, throbbing ear pain, fluid drainage, ear fullness, irritability plus hearing loss recently.",otitis media
"Recently I've been having ear ache, hearing loss and fluid drainage and I don't know what to do.",otitis media
"I keep having ear fullness, high temperature, throbbing ear pain, fluid drainage and irritability for a while now.",otitis media
"Been having irritability, hearing loss, ear fullness, my body's been burning up and fluid drainage recently.",otitis media
"Recently I've been having running a temperature, losing weight unexpectedly, throwing up, tummy ache and also the urge to vomit recently.",pancreatitis
"Lately I've had high temperature, queasiness, losing weight unexpectedly, tummy ache plus vomiting a lot recently.",pancreatitis
Recently I've been having unintentional weight drop as well as running a temperature.,pancreatitis
"Lately I've had throwing up, gut pain, also unintentional weight drop and I'm worried.",pancreatitis
I've been experiencing the urge to vomit combined with vomiting a lot for a while now.,pancreatitis
"I have gut pain, feeling sick to my stomach, also rapid pulse recently.",pancreatitis
"I'm suffering from rapid pulse, unintentional weight drop combined with tummy ache recently.",pancreatitis
I'm dealing with queasiness combined with tummy ache recently.,pancreatitis
"I'm suffering from queasiness, tummy ache combined with rapid pulse since a few days.",pancreatitis
I've been experiencing a bit rapid pulse and tummy ache for a while now.,pancreatitis
"Been having abdominal tenderness, the urge to vomit, tummy ache nd dropping weight without trying and I don't know what to do.",pancreatitis
"Been having dropping weight without trying, vomiting a lot and stomach cramps since a few days.",pancreatitis
"I have losing weight unexpectedly, throwing up, abdominal tenderness and gut pain.",pancreatitis
"I've been dealing with stomach cramps, upset stomach plus been sick multiple times.",pancreatitis
"I've been dealing with feeling sick to my stomach, abdominal tenderness, pain in my belly and losing weight unexpectedly and it's getting worse.",pancreatitis
"I wanted to tell you about puking, dropping weight without trying and rapid pulse recently.",pancreatitis
"For a while now I've had puking, unintentional weight drop, rapid pulse, tummy ache plus upset stomach since a few days.",pancreatitis
"My problem is rapid pulse, throwing up, feeling sick to my stomach, abdominal tenderness and also tummy ache.",pancreatitis
"I feel vomiting a lot, abdominal tenderness, the urge to vomit, losing weight unexpectedly and tummy ache and I'm worried n stuff",pancreatitis
"I feel throwing up, losing weight unexpectedly, abdominal tenderness and rapid pulse and it's getting worse.",pancreatitis
I keep feeling stomach cramps and rapid pulse recently.,pancreatitis
"I keep noticing vomiting a lot, gut pain as well as abdominal tenderness and it's getting worse.",pancreatitis
"I'm troubled by puking, abdominal tenderness, rapid pulse and tummy ache.",pancreatitis
I'm suffering from abdominal tenderness and rapid pulse and it's getting worse.,pancreatitis
"I keep feeling rapid pulse, abdominal tenderness, pain in my belly n puking.",pancreatitis
"I keep having slowed movement, muscle rigidity as well as balance problems.",parkinson's disease
I've been going through balance problems and feeling completely worn out and it's getting worse.,parkinson's disease
"Been having uncontrollable trembling, tiredness, slowed movement, balance problems and muscle rigidity.",parkinson's disease
"doc I've been having muscle rigidity, slowed movement, trembling hands and balance problems recently.",parkinson's disease
I keep having trembling hands as well as muscle rigidity.,parkinson's disease
"Recently I've been having balance problems, writing difficulty, also slowed movement for a while now.",parkinson's disease
"I feel hands keep shaking, exhaustion, muscle rigidity, slowed movement, balance problems and writing difficulty.",parkinson's disease
"I keep feeling balance problems, muscle rigidity as well as hands keep shaking since a few days.",parkinson's disease
"I'm struggling with muscle rigidity, writing difficulty, slowed movement, tiredness and trembling hands and it's getting worse.",parkinson's disease
"I've been dealing with balance problems, low energy, muscle rigidity, hands keep shaking, writing difficulty and slowed movement.",parkinson's disease
"I feel trembling hands, feeling completely worn out and speech changes recently.",parkinson's disease
"Recently I've been having always tired, speech changes, muscle rigidity and slowed movement since a few days.",parkinson's disease
"I've been dealing with balance problems, slowed movement and trembling hands recently.",parkinson's disease
"I have balance problems, muscle rigidity, always tired, slowed movement and also uncontrollable trembling recently.",parkinson's disease
"I'm suffering from muscle rigidity, balance problems, hands keep shaking, always tired, slowed movement and speech changes and I'm worried tbh",parkinson's disease
"I keep having muscle rigidity, slowed movement plus speech changes and I don't know what to do.",parkinson's disease
"Been having slowed movement, muscle rigidity, speech changes, balance problems, always tired and also writing difficulty.",parkinson's disease
"Lately I've had muscle rigidity, balance problems, speech changes, low energy and slowed movement for a while now.",parkinson's disease
"My problem is speech changes, tiredness and slowed movement since a few days.",parkinson's disease
"Lately I've had balance problems, feeling completely worn out and speech changes.",parkinson's disease
"Doctor, I'm dealing with balance problems, involuntary shaking combined with writing difficulty recently.",parkinson's disease
"Been having muscle rigidity, balance problems, slowed movement and writing difficulty.",parkinson's disease
"I keep experiencing muscle rigidity, slowed movement, writing difficulty and balance problems and I'm worried.",parkinson's disease
"I keep feeling writing difficulty, balance problems, muscle rigidity, slowed movement and uncontrollable trembling and I'm worried.",parkinson's disease
Lately I've been dealing with involuntary shaking plus balance problems and I'm worried.,parkinson's disease
"I keep feeling losing weight unexpectedly, throwing up, heartburn and upset stomach for a while now.",peptic ulcer disease
"Been having heartburn, no desire to eat, the urge to vomit and puking since a few days.",peptic ulcer disease
"I feel losing weight unexpectedly, can't eat properly, bloating, vomiting a lot, the urge to vomit plus heartburn recently.",peptic ulcer disease
"My problem is lost my appetite, feeling sick to my stomach, burning stomach pain, throwing up and also losing weight unexpectedly.",peptic ulcer disease
"Lately I've had no desire to eat, throwing up, also bloating and I'm worried.",peptic ulcer disease
"I've been experiencing burning stomach pain, can't eat properly, also upset stomach and I don't know what to do.",peptic ulcer disease
"I wanted to tell you about lost my appetite, heartburn, unintentional weight drop, bloating and throwing up.",peptic ulcer disease
"I wanted to tell you about vomiting a lot, burning stomach pain, losing weight unexpectedly, the urge to vomit, heartburn and can't eat properly since a few days.",peptic ulcer disease
"I have burning stomach pain, can't eat properly plus upset stomach and it's getting worse.",peptic ulcer disease
"I wanted to tell you about lost my appetite, burning stomach pain, bloating, vomiting a lot plus unintentional weight drop since a few days.",peptic ulcer disease
"Been having been sick multiple times, feeling sick to my stomach, bloating and heartburn.",peptic ulcer disease
"I have heartburn, dropping weight without trying, feeling sick to my stomach and puking since a few days.",peptic ulcer disease
"I'm suffering from feeling sick to my stomach, heartburn and bloating and I'm worried.",peptic ulcer disease
I've been experiencing dropping weight without trying as well as throwing up recently.,peptic ulcer disease
"I have dropping weight without trying, throwing up, bloating and heartburn since a few days.",peptic ulcer disease
I keep feeling heartburn and been sick multiple times.,peptic ulcer disease
"I wanted to tell you about queasiness, heartburn, been sick multiple times and unintentional weight drop and it's getting worse.",peptic ulcer disease
"The issue I'm facing is throwing up, unintentional weight drop, bloating and heartburn for a while now.",peptic ulcer disease
"I've been experiencing unintentional weight drop, vomiting a lot, bloating and feelin sick to my stomach and I don't know what to do.",peptic ulcer disease
"Doctor, I'm struggling with puking plus bloating recently.",peptic ulcer disease
"I keep feeling burning stomach pain, throwing up and heartburn for a while now.",peptic ulcer disease
"I feel burning stomach pain, losing weight unexpectedly, vomiting a lot and heartburn.",peptic ulcer disease
"I have burning stomach pain, throwing up, heartburn and dropping weight without trying since a few days.",peptic ulcer disease
"Recently I've been having burning stomach pain, heartburn and vomiting a lot since a few days.",peptic ulcer disease
"I keep feeling puking, burning stomach pain along with dropping weight without trying.",peptic ulcer disease
"I keep having unintentional weight drop, heartburn, burning stomach pain and been sick multiple times.",peptic ulcer disease
"Lately I've had burning stomach pain, been sick multiple times and heartburn and I'm worried.",peptic ulcer disease
"I've been struggling with heartburn, throwing up, unintentional weight drop and burning stomach pain since a few days.",peptic ulcer disease
"Been having heartburn, unintentional weight drop combined with burning stomach pain.",peptic ulcer disease
I keep getting losing weight unexpectedly and throwing up.,peptic ulcer disease
"My problem is throwing up, bloating, unintentional weight drop, heartburn plus burning stomach pain and it's getting worse.",peptic ulcer disease
"Lately I've had burning stomach pain, bloating, losing weight unexpectedly, feeling sick to my stomach and also heartburn since a few days.",peptic ulcer disease
"I keep feeling upset stomach, throwing up combined with bloating.",peptic ulcer disease
"Recently I've been having unintentional weight drop, burning stomach pain, heartburn and been sick multiple times and I don't know what to do.",peptic ulcer disease
"I'm suffering from bloating, queasiness, vomiting a lot, dropping weight without trying, burning stomach pain plus heartburn and it's getting worse.",peptic ulcer disease
"I have bloating, losing weight unexpectedly, upset stomach and been sick multiple times and I'm worried.",peptic ulcer disease
"These days I've been having burning stomach pain, bloating as well as throwing up.",peptic ulcer disease
"Lately I've had unintentional weight drop, heartburn, queasiness, vomiting a lot plus bloating for a while now.",peptic ulcer disease
"My problem is the urge to vomit, dropping weight without trying, burning stomach pain and bloating for a while now.",peptic ulcer disease
"What's bothering me is bloating, heartburn, feeling sick to my stomach, losing weight unexpectedly and burning stomach pain.",peptic ulcer disease
"I've been dealing with upset stomach, also been sick multiple times.",peptic ulcer disease
"I keep feeling been sick multiple times, upset stomach plus burning stomach pain and I'm worried.",peptic ulcer disease
"doc I've been having queasiness, vomiting a lot, also bloating recently.",peptic ulcer disease
"been dealing with queasiness, burning stomach pain, bloating and been sick multiple times for a while now.",peptic ulcer disease
"I feel bloating, vomiting a lot, burning stomach pain and queasiness and I don't know what to do.",peptic ulcer disease
"I feel burning stomach pain, been sick multiple times, bloating and feeling sick to my stomach.",peptic ulcer disease
I have queasiness combined with been sick multiple times for a while now.,peptic ulcer disease
"Been having bloating, throwing up and queasiness.",peptic ulcer disease
"I have bloating, upset stomach, burning stomach pain and vomiting a lot and I'm worried.",peptic ulcer disease
"I've been dealing with been sick multiple times, burning stomach pain, also feeling sick to my stomach and I don't know what to do.",peptic ulcer disease
"Doctor, I'm dealing with my body's been burning up, chest hurts, breathlessness and feeling drained.",pneumonia
"I'm suffering from rapid breathing, chills, always tired, tightness in my chest and also breathlessness and I don't know what to do.",pneumonia
"My problem is tiredness, chills, chest hurts, running a temperature, getting winded easily plus rapid breathing and I'm worried.",pneumonia
