symptom,disease
"Recently I've been having blisters (fluid-filled), constant headaches as well as itchy rash.",chicken pox
"I keep feeling itchy rash, blisters (fluid-filled) combined with throbbing head pain for a while now tbh",chicken pox
"I've been going through blisters (fluid-filled), itchy rash and throbbing head pain.",chicken pox
"I have terrible head pain, itchy rash plus blisters (fluid-filled) for a while now.",chicken pox
"I'm suffering from blisters (fluid-filled), my head's been pounding n itchy rash recently.",chicken pox
"Been having my muscles hurt, lack of focus, terrible head pain, always tired plus sleep disturbances.",chronic fatigue syndrome
I have my head's been pounding and lack of focus and I don't know what to do.,chronic fatigue syndrome
"I feel constant headaches, tiredness, sleep disturbances, muscle aches plus mind keeps wandering for a while now.",chronic fatigue syndrome
"I've been dealing with can't focus at all, feeling completely worn out, sleep disturbances and sore muscles.",chronic fatigue syndrome
"I keep experiencing mind keeps wandering, sleep disturbances and feeling completely worn out and it's getting worse.",chronic fatigue syndrome
"I keep having feeling drained, sleep disturbances and scratchy throat and it's getting worse.",chronic fatigue syndrome
Recently I've been having my muscles hurt and sleep disturbances.,chronic fatigue syndrome
Recently I've been having can't swallow properly and sleep disturbances.,chronic fatigue syndrome
These days I've been having can't swallow properly and body aches all over for a while now.,chronic fatigue syndrome
I've been dealing with sore muscles and feeling completely worn out recently.,chronic fatigue syndrome
"I've been struggling with sore muscles, hard to concentrate, low energy, my head's been pounding, sore joints and sleep disturbances since a few days.",chronic fatigue syndrome
"Lately I've been dealing with my head's been pounding, pain in my joints and sleep disturbances for a while now.",chronic fatigue syndrome
"I've been experiencing sleep disturbances, throbbing head pain, tiredness and muscle aches and I don't know what to do.",chronic fatigue syndrome
"I wanted to tell you about my head's been pounding, sleep disturbances and muscle aches recently.",chronic fatigue syndrome
"The issue I'm facing is feeling completely worn out, hard to concentrate, joints hurting bad and muscle aches recently.",chronic fatigue syndrome
"I keep having sleep disturbances, aching joints, also low energy.",chronic fatigue syndrome
"Recently I've been having pain in my joints, my muscles hurt plus can't focus at all and I'm worried.",chronic fatigue syndrome
I keep having feels like lack of focus as well as sleep disturbances.,chronic fatigue syndrome
I have pain in my joints as well as low energy and it's getting worse.,chronic fatigue syndrome
I keep having sleep disturbances combined with feeling drained.,chronic fatigue syndrome
"My problem is sore muscles, terrible head pain as well as sleep disturbances recently.",chronic fatigue syndrome
"I'm suffering from pain in my joints, terrible head pain along with sleep disturbances.",chronic fatigue syndrome
"I keep having tiredness, muscle aches, my head's been pounding, painful throat and sleep disturbances for a while now.",chronic fatigue syndrome
"Been having muscle aches, aching joints, painful throat, throbbing head pain and sleep disturbances recently.",chronic fatigue syndrome
"I'm dealing with feeling completely worn out, terrible head pain, sleep disturbances, aching joints, painful throat n also sore muscles for a while now.",chronic fatigue syndrome
"I keep getting always tired, swollen area, muscle cramps and lost my appetite since a few days.",chronic kidney disease
"My problem is frequent urination, also no desire to eat for a while now.",chronic kidney disease
"What's bothering me is muscle cramps, puffiness, tiredness, lost my appetite plus frequent urination.",chronic kidney disease
I keep having always tired combined with muscle cramps and I'm worried.,chronic kidney disease
"I have frequent urination, swollen area, also no desire to eat for a while now.",chronic kidney disease
"Lately I've had my body looks swollen, frequent urination, feeling sick to my stomach, severe itching, exhaustion and not feeling hungry at all and I don't know what to do.",chronic kidney disease
"Been having a bit not feelin hungry at all, queasiness plus visible swelling and I'm worried.",chronic kidney disease
"I'm suffering from feeling completely worn out, no desire to eat, upset stomach and frequent urination and I'm worried.",chronic kidney disease
"I keep having visible swelling, feeling sick to my stomach along with can't eat properly recently.",chronic kidney disease
"Been having frequent urination, always tired, my body looks swollen, itchy skin, can't eat properly and feelin sick to my stomach recently.",chronic kidney disease
"Recently I've been having no desire to eat, feeling completely worn out, muscle cramps, itchy skin, puffiness and also frequent urination.",chronic kidney disease
"I've been experiencing lost my appetite, muscle cramps and visible swelling.",chronic kidney disease
"I have muscle cramps, frequent urination, always tired and can't eat properly and I don't know what to do.",chronic kidney disease
"Lately I've had muscle cramps, my body looks swollen, severe itching, always tired, can't eat properly and frequent urination for a while now.",chronic kidney disease
"Recently I've started having muscle cramps, frequent urination, severe itching and can't eat properly for a while now.",chronic kidney disease
"Doctor, I'm struggling with my body looks swollen and no desire to eat and it's getting worse.",chronic kidney disease
I keep feeling no desire to eat as well as muscle cramps recently.,chronic kidney disease
"I've been experiencing puffiness, frequent urination and muscle cramps.",chronic kidney disease
I have visible swelling combined with frequent urination.,chronic kidney disease
Been having frequent urination along with no desire to eat nd it's getting worse.,chronic kidney disease
"I've been dealing with queasiness, muscle cramps, can't stop itching, not feeling hungry at all and low energy and I don't know what to do.",chronic kidney disease
"I keep noticing can't stop itching, not feeling hungry at all, the urge to vomit and muscle cramps recently.",chronic kidney disease
"I've been experiencing muscle cramps, frequent urination and lost my appetite and I'm worried.",chronic kidney disease
"Been having not feeling hungry at all, frequent urination, feeling drained, muscle cramps, severe itching and upset stomach.",chronic kidney disease
"I keep having frequent urination, not feeling hungry at all and muscle cramps since a few days.",chronic kidney disease
I wanted to tell you about nasal congestion combined with nose keeps running recently.,common cold
"I'm suffering from nasal congestion, my throat is killing me, persistent cough, constant nasal drip and also watery eyes.",common cold
"I'm struggling with can't stop coughing, nasal congestion combined with watery eyes.",common cold
"I've been experiencing constant nasal drip, watery eyes plus a nagging cough and I don't know what to do.",common cold
"I keep having nasal congestion, watery eyes combined with coughing constantly and I don't know what to do.",common cold
My problem is can't swallow properly and nasal congestion since a few days.,common cold
"I feel a nagging cough, nasal congestion, can't swallow properly and watery eyes.",common cold
I've been experiencing a nagging cough and nasal congestion.,common cold
"I keep having nasal congestion, watery eyes, nose keeps running and can't swallow properly and I'm worried.",common cold
"Recently I've been having nose keeps running, nasal congestion, scratchy throat, watery eyes and coughing constantly for a while now.",common cold
"Recently I've been having nose keeps running, can't swallow properly, running a temperature, watery eyes, coughing constantly and also nasal congestion and I'm worried.",common cold
"I wanted to tell you about nasal congestion, watery eyes, can't stop coughing, running a temperature, can't swallow properly plus constant nasal drip recently.",common cold
"Been having running a temperature, my throat is killing me, watery eyes and nasal congestion and I don't know what to do.",common cold
"Recently I've been dealing with my body's been burning up, constant nasal drip, watery eyes and persistent cough.",common cold
"I keep experiencing nasal congestion, coughing constantly and my throat is killing me and it's getting worse.",common cold
"I feel watery eyes, running a temperature, nose keeps running and painful throat and I'm worried.",common cold
"I wanted to tell you about nasal congestion, a nagging cough, my throat is killing me n running a temperature recently.",common cold
"Recently I've been experiencing watery eyes, persistent cough, nose keeps running and nasal congestion for a while now.",common cold
"I feel running a temperature, coughing constantly, watery eyes, nasal congestion, painful throat and nose keeps running and I'm worried.",common cold
"Lately I've had watery eyes, nasal congestion combined with painful throat for a while now.",common cold
"I feel nasal congestion, can't swallow properly plus sneezing and I'm worried.",common cold
"I've been experiencing can't stop coughing, nose keeps running, also painful throat and I don't know what to do.",common cold
"Recently I've been having nasal congestion, watery eyes, persistent cough, sneezing and scratchy throat and it's getting worse.",common cold
"I've been dealing with watery eyes, sneezing, nasal congestion, can't stop coughing and can't swallow properly for a while now.",common cold
"I'm suffering from nasal congestion, sneezing as well as watery eyes and I'm worried.",common cold
"I'm suffering from nasal congestion, watery eyes, constant nasal drip, coughing constantly and sneezing.",common cold
"Been having can't stop coughing, nasal congestion, fluid coming from nose, watery eyes, feeling feverish and also sneezing recently.",common cold
"I've been dealing with fluid coming from nose, a nagging cough, can't swallow properly and high temperature since a few days.",common cold
"I feel high temperature, watery eyes, a nagging cough and nasal congestion for a while now.",common cold
"Recently I've been having painful throat, my body's been burning up, nasal congestion, watery eyes, nose keeps running and persistent cough.",common cold
"Been having fluid coming from nose, scratchy throat plus nasal congestion and it's getting worse.",common cold
"My problem is fluid coming from nose, persistent cough and watery eyes since a few days.",common cold
"I keep feeling a nagging cough, nasal congestion, watery eyes, sneezing, constant nasal drip and painful throat.",common cold
"I've been dealing with watery eyes, nasal congestion, sneezing and my throat is killing me.",common cold
"I wanted to tell you about nose keeps running, nasal congestion, persistent cough and watery eyes and it's getting worse.",common cold
"Recently I've been having watery eyes, nasal congestion as well as can't swallow properly and I don't know what to do.",common cold
"Doctor, I'm dealing with feels like sneezing, nasal congestion, constant nasal drip and watery eyes and it's getting worse.",common cold
"Lately I've had sneezing, watery eyes and scratchy throat since a few days.",common cold
"I wanted to tell you about fluid coming from nose, coughing constantly as well as my throat is killing me and I'm worried.",common cold
"My problem is nasal congestion, sneezing, painful throat, watery eyes and fluid coming from nose and I don't know what to do.",common cold
"I wanted to tell you about running a temperature, nose keeps running, watery eyes, a nagging cough, nasal congestion and sneezing since a few days rly bad",common cold
"I feel watery eyes, a nagging cough combined with nasal congestion.",common cold
"I keep having nasal congestion, persistent cough, sneezing, nose keeps running, watery eyes plus high temperature recently.",common cold
"I keep feeling nasal congestion, watery eyes, fluid coming from nose, coughing constantly and high temperature.",common cold
"I've been dealing with nasal congestion, my body's been burning up, also watery eyes.",common cold
"I keep having watery eyes, persistent cough, sneezing, feeling feverish, nasal congestion and constant nasal drip.",common cold
"Recently I've been having watery eyes, my body's been burning up combined with constant nasal drip.",common cold
"I wanted to tell you about watery eyes, nose keeps running, can't stop coughing, feeling feverish and nasal congestion, worried",common cold
"I keep having watery eyes, running a temperature, nose keeps running, nasal congestion and coughing constantly recently.",common cold
"I wanted to tell you about running a temperature, can't stop coughing, constant nasal drip, nasal congestion, watery eyes and sneezing for a while now.",common cold
I'm suffering from bright lights are painful and watery eyes.,conjunctivitis
"Doctor, I'm dealing with can't stop itching, red eyes and hot burning sensation.",conjunctivitis
"I'm suffering from bright lights are painful, itchy skin, stinging burn and red eyes and I don't know what to do.",conjunctivitis
"My problem is itchy skin, watery eyes along with light hurts my eyes and it's getting worse.",conjunctivitis
"Doctor, I've been having red eyes, light hurts my eyes, hot burning sensation and can't stop itching and I don't know what to do.",conjunctivitis
"I've been experiencing swollen area, discharge from eyes, red eyes and severe itching recently.",conjunctivitis
"I keep having red eyes, discharge from eyes and puffiness.",conjunctivitis
"My problem is constant scratching, watery eyes, also red eyes recently.",conjunctivitis
"I keep noticing puffiness, watery eyes, discharge from eyes, itchy skin and also red eyes.",conjunctivitis
"Been having can't stop itching, discharge from eyes, red eyes, my body looks swollen and watery eyes for a while now.",conjunctivitis
"I feel red eyes, discharge from eyes, watery eyes and photosensitivity.",conjunctivitis
"I'm suffering from constant scratching, light hurts my eyes, watery eyes, discharge from eyes and red eyes recently rly bad",conjunctivitis
"Been having red eyes, bright lights are painful, constant scratching, discharge from eyes and also watery eyes for a while now.",conjunctivitis
"I wanted to tell you about severe itching, bright lights are painful and red eyes for a while now.",conjunctivitis
"Doctor, I'm dealing with severe itching, discharge from eyes plus watery eyes.",conjunctivitis
I have itchy skin as well as red eyes.,conjunctivitis
I'm troubled by itchy skin and burning feeling recently.,conjunctivitis
"I wanted to tell you about burning feeling, watery eyes and itchy skin recently.",conjunctivitis
"I have stinging burn, red eyes plus my body looks swollen recently.",conjunctivitis
"I've been experiencing visible swelling, watery eyes and severe itching.",conjunctivitis
"I keep having itchy skin, watery eyes, discharge from eyes and red eyes recently.",conjunctivitis
"Recently I've been having hot burning sensation, red eyes, watery eyes, discharge from eyes, constant scratching plus light hurts my eyes and I don't know what to do.",conjunctivitis
"I have watery eyes, severe itching, bright lights are painful, stinging burn, discharge from eyes plus red eyes recently.",conjunctivitis
"I wanted to tell you about burning feeling, watery eyes and red eyes and I don't know what to do.",conjunctivitis
"I keep getting red eyes, watery eyes, stinging burn, bright lights are painful and also discharge from eyes recently.",conjunctivitis
"Lately I've been dealing with kinda breathlessness, my throat is killing me, body aches, exhaustion plus can't stop coughing.",covid-19
"I feel losing my taste or smell, exhaustion, a nagging cough, breathlessness and also body aches since a few days.",covid-19
"Over the past few days I've noticed persistent cough, exhaustion, can't swallow properly, body aches, losing my taste or smell and also hard to breathe for a while now.",covid-19
"I'm going through scratchy throat, losing my taste or smell, coughing constantly and body aches and it's getting worse.",covid-19
"I have losing my taste or smell, my throat is killing me, also hard to breathe and it's getting worse.",covid-19
"Lately I've had body aches, running a temperature, losing my taste or smell, low energy plus coughing constantly.",covid-19
Recently I've been having my body's been burning up along with losing my taste or smell since a few days.,covid-19
My problem is feeling feverish and losing my taste or smell.,covid-19
I wanted to tell you about high temperature and coughing constantly.,covid-19
"I keep having coughing constantly, feeling feverish, body aches and always tired.",covid-19
"I wanted to tell you about body aches, losing my taste or smell, always tired and high temperature and I don't know what to do.",covid-19
"I've been having losing my taste or smell, body aches along with high temperature.",covid-19
"I'm suffering from body aches, high temperature, losing my taste or smell and exhaustion recently.",covid-19
"I've been experiencing feeling drained, high temperature, body aches and losing my taste or smell.",covid-19
I keep feelin running a temperature and low energy and I'm worried.,covid-19
"Been having running a temperature, feeling completely worn out, losing my taste or smell and getting winded easily and I don't know what to do.",covid-19
I wanted to tell you about losing my taste or smell as well as tiredness and it's getting worse rly bad,covid-19
"Doctor, I'm dealing with hard to breathe as well as losing my taste or smell.",covid-19
"I keep having losing my taste or smell, my body's been burning up, feeling completely worn out, hard to breathe plus can't stop coughing.",covid-19
"I feel a nagging cough, losing my taste or smell and tiredness since a few days.",covid-19
"I wanted to tell you about body aches, feeling feverish, trouble catching my breath and losing my taste or smell and it's getting worse.",covid-19
keep feeling body aches combined with losing my taste or smell since a few days.,covid-19
I feel body aches and getting winded easily.,covid-19
"I'm suffering from losing my taste or smell, feeling feverish, getting winded easily and body aches.",covid-19
"I wanted to tell you about feeling feverish, hard to breathe and losing my taste or smell.",covid-19
"My problem is pain in my belly, lost my appetite, my body's been burning up, loose watery stools and also bloody movements and I don't know what to do.",crohn's disease
"I feel seeing blood in toilet, can't eat properly, stomach cramps and my body's been burning up.",crohn's disease
"I keep noticing watery movements, also gut pain and I don't know what to do.",crohn's disease
"I've been dealing with blood in my stool, frequent bathroom trips, my body's been burning up, stomach cramps plus not feeling hungry at all.",crohn's disease
"Recently I've been having bloody movements, running a temperature, also watery movements.",crohn's disease
I wanted to tell you about blood in my stool and high temperature since a few days.,crohn's disease
Lately I've had lost my appetite combined with loose watery stools for a while now.,crohn's disease
"I wanted to tell you about tiredness, bloody movements as well as tummy ache recently.",crohn's disease
For a while now I've had tummy ache and exhaustion and it's getting worse.,crohn's disease
"The issue I'm facing is blood in my stool, always tired, losing weight unexpectedly and pain in my belly.",crohn's disease
I'm dealing with feeling drained n also seeing blood in toilet and I'm worried.,crohn's disease
"I keep feeling low energy, bloody movements and tummy ache.",crohn's disease
"Lately I've had feelin completely worn out, unintentional weight drop, stomach cramps and runny stomach since a few days.",crohn's disease
"My problem is gut pain, blood in my stool, loose watery stools and unintentional weight drop recently.",crohn's disease
"I have tiredness, gut pain, dropping weight without trying, high temperature, seeing blood in toilet and also not feeling hungry at all.",crohn's disease
"Been having can't eat properly, running a temperature, loose watery stools, seeing blood in toilet, dropping weight without trying and also gut pain and it's getting worse.",crohn's disease
"My problem is running a temperature, seeing blood in toilet and no desire to eat for a while now.",crohn's disease
"I keep having feeling feverish, always tired, dropping weight without trying, seeing blood in toilet, frequent bathroom trips and pain in my belly recently.",crohn's disease
"What's bothering me is seeing blood in toilet, my body's been burning up, loose watery stools and always tired.",crohn's disease
"I keep experiencing watery movements, tummy ache, tiredness and unintentional weight drop since a few days.",crohn's disease
"I have tummy ache, high temperature, losing weight unexpectedly, blood in my stool, always tired, loose watery stools plus not feeling hungry at all and I'm worried.",crohn's disease
"I've been experiencing seeing blood in toilet, pain in my belly and loose watery stools.",crohn's disease
"Been having tummy ache, seeing blood in toilet, no desire to eat, loose watery stools, feeling drained and my body's been burning up and it's getting worse.",crohn's disease
"I wanted to tell you about stomach cramps, high temperature and lost my appetite.",crohn's disease
"Recently I've started having not feeling hungry at all, seeing blood in toilet, high temperature and runny stomach and it's getting worse.",crohn's disease
"I keep having pain in my belly, seeing blood in toilet, can't eat properly and high temperature and it's getting worse.",crohn's disease
"I've been dealing with always tired, watery movements, high temperature, blood in my stool, stomach cramps and not feeling hungry at all.",crohn's disease
"Been having not feeling hungry at all, watery movements, gut pain and bloody movements and it's getting worse.",crohn's disease
"I have blood in my stool, stomach cramps and dropping weight without trying and I'm worried.",crohn's disease
"Doctor, I'm dealing with blood in my stool, pain in my belly along with losing weight unexpectedly and it's getting worse.",crohn's disease
"Lately I've had seeing blood in toilet, gut pain combined with losing weight unexpectedly and it's getting worse.",crohn's disease
"I keep feeling dropping weight without trying, gut pain and bloody movements rly bad",crohn's disease
"I feel losing weight unexpectedly, blood in my stool and pain in my belly.",crohn's disease
"Lately I've had bloody movements, dropping weight without trying and gut pain.",crohn's disease
"I've been experiencing stomach cramps, blood in my stool along with unintentional weight drop.",crohn's disease
"My problem is queasiness, terrible head pain, also running a temperature for a while now.",dengue
"I've been dealing with throbbing head pain, feeling sick to my stomach, pain behind eyes and my body's been burning up and I don't know what to do.",dengue
"I've been dealing with my head's been pounding, feeling feverish combined with queasiness.",dengue
"I feel queasiness, high temperature, terrible head pain and pain behind eyes.",dengue
"Been having upset stomach, my head's been pounding, my body's been burning up and pain behind eyes and I'm worried.",dengue
Been having pain behind eyes and aching joints.,dengue
"I have my body's been burning up, pain behind eyes along with aching joints recently.",dengue
"I'm suffering from pain behind eyes, constant headaches, joints hurting bad and feeling feverish.",dengue
"Doctor, I'm dealing with aching joints, constant headaches and high temperature.",dengue
"My problem is pain in my joints, also terrible head pain.",dengue
"I keep feeling my head's been pounding, sore muscles, also rash all over my skin.",dengue
"I keep experiencing my muscles hurt, constant headaches and red skin rash.",dengue
"Doctor, I'm dealing with muscle aches, my head's been pounding as well as rash all over my skin.",dengue
"Been having rash all over my skin, muscle aches plus constant headaches.",dengue
"I'm suffering from throbbing head pain, rash all over my skin along with muscle aches since a few days.",dengue
"I've been going through high temperature, my head's been pounding, pain behind eyes, muscle aches, red skin rash plus feeling sick to my stomach for a while now.",dengue
"I wanted to tell you about terrible head pain, joints hurting bad, my body's been burning up, rash all over my skin, my muscles hurt, pain behind eyes and also feeling sick to my stomach.",dengue
"I've been experiencing joints hurting bad, rash all over my skin, body aches all over, queasiness, pain behind eyes, constant headaches and feeling feverish and it's getting worse.",dengue
"I have running a temperature, pain in my joints, queasiness, sore muscles, pain behind eyes and also rash all over my skin.",dengue
"Lately I've had running a temperature, terrible head pain, feeling sick to my stomach, pain behind eyes and muscle aches and it's getting worse.",dengue
I've been dealing with queasiness plus aching joints recently.,dengue
"I've been experiencing feeling feverish, pain in my joints, constant headaches, queasiness and also muscle aches and it's getting worse.",dengue
"Doctor, I've been experiencing my muscles hurt and constant headaches and I'm worried.",dengue
I've been experiencing a bit feeling sick to my stomach and body aches all over since a few days.,dengue
"Been having the urge to vomit, feeling feverish n sore joints and it's getting worse.",dengue
